video_id,video_title
k-1Ep7e64iE,"CERITA UNIK! Alex Pastoor Sang Analis : ""Ya, Saya Sudah Siap di Timnas Indonesia...!"""
rHSKfdwOJpM,"Alex Pastoor Analisis Laga Timnas VS Arab, Patrick Kluivert Temui Perwakilan Klub Liga 1"
4nFVCMPC5P4,Akmal: Asisten Pelatih Alex Pastoor Ahli Dalam Meracik Taktik | Kabar Petang tvOne
r3PzKS8FS0g,ALEX PASTOOR JENIUS! 2 Pemain Keturunan baru di Inggris ditemukan~Kluivert tak salah pilih asisten
V2IiGOV0uQM,OTAKNYA Timnas Indonesia Nih! Paket Komplit Alex Pastoor dan Denny Landzaat
8F5QTFCNqtE,Ketum PSSI Erick Thohir Beber Alasan Alex Pastoor Belum Ikut Patrick Kluivert ke Indonesia
mCo8BVZp0os,"Mantap! Dedikasi Alex Pastoor: Belajar Sejarah, Geografi, dan Kini Strategi Garuda | OneNews Update"
O_zVc02kvuk,Hadirnya Alex Pastoor dan Denny Landzaat Bisa Jadi Pembeda di Tim Kepelatihan Timnas Indonesia
MMr_V86LmmM,"Timnas Indonesia: Mode Serius, Alex Pastoor Langsung Analisis Laga Sebelumnya"
33Ea2s0vGeU,"PSSI Tunjuk Alex Pastoor Jadi Asisten Kluivert di Timnas, Ini Profilnya - [Primetime News]"
LO9Dk-cwZ-U,MENAKJUBKAN! Alex Pastoor Belajar Sejarah Indonesia dari Buku Langka
50Z_Tp-euYM,TERNYATA ‼️ INI ALASAN ALEX PASTOOR INGIN BERGABUNG BERSAMA TIMNAS INDONESIA
MY-5M7LJIgY,"ERA BARU TIMNAS INDONESIA: KLUIVERT, ALEX PASTOOR & DANNY LANDZAAT SIAP BAWA GARUDA TERBANG TINGGI!"
x3xxze7R1cA,"Memahami Peran Patrick Kluivert, Alex Pastoor dan Denny, Potensi Besar TIMNAS main full attack!"
OqDhT1fg6cQ,Mengenal Alex Pastoor: Asisten Pelatih Baru dengan Segudang Pengalaman
2-vt51t2qTI,🔴 SEMUANYA BISA DI BUAT TERKEJUT !! ALEX PASTOOR Langsung Buat Pengakuan JUJUR Gini Soal Timnas Indo
Z135W-mdWH8,"Punya Reputasi Handal, Alex Pastoor Jadi Asisten Pelatih Timnas Indonesia?"
_Taec4QHp4g,"Mantap Coach! Setelah Belajar Sejarah, Alex Pastoor Kini Giat Pelajari Taktik Timnas Indonesia"
SKTx8tZoVoo,"Jadi ini alasannya, Alex Pastoor bikin Bahrain gemetar! Kluivert bicara suporter,jadi pengalihan isu"
gp-e0kJAlqk,"Sebelum Bertugas, Alex Pastoor Belajar Tentang Indonesia Melalui Buku Sejarah | OneNews Update"
GRy-TJL5YHg,"PATRICK KLUIVERT,ALEX PASTOOR & DANNY LANZAD TARGETKAN TIMNAS INDONESIA LOLOS PIALA DUNIA"
IpmRYOQKMRA,Alex Pastoor Belajar Peta Indonesia - [Metro Pagi Primetime]
VWuZ5bYLCvY,"ALEX PASTOOR BELAJAR ATLAS, NETIZEN: RAJA TAKTIK PURA PURA ASISTEN"
GaaudlrpRX0,"[EKSKLUSIF] Patrick Kluivert, Pelatih Baru Timnas | Mata Najwa"
DFUhWbv1Ssk,"Mengungkap Sosok Alex Pastoor, Strategi Besar untuk Timnas Indonesia"
znfw9UlGDj8,🔴 DIHADIRI ALEX PASTOOR! Detik2 Sumpah WNI Ole Romeny Heboh ~ Paes Dapat Trofi MLS ~ Jairo Deal
Gm2kBN4ziaQ,"Sepak Terjang Alex Pastoor, Asisten Pelatih Baru Timnas Indonesia"
RgdAX7hE0Oc,"Kluivert Bawa ""Profesor"" ke Timnas Indonesia : Bedah Alex Pastoor & Denny Landzaat, Analis Handal"
XxHSNNyx2Ec,Kisah Alex Pastoor Dituduh Tukang Cepu?
j7YKZ8AGII0,Simak! Ini Penyebab Alex Pastoor Baru Bergabung dengan Timnas Februari Mendatang
yh6rD257NIY,ERICK THOHIR JELASKAN KENAPA ALEX PASTOOR TIDAK IKUT PATRICK KLUIVERT KE INDONESIA
-nOaXCtL1L8,ALASAN PATRICK KLUIVERT PILIH ALEX PASTOOR DAN DENNY LANDZAAT #timnascalling #timnas #shintaeyong
Mb8i-w7rzkM,ini CV dan statistik asisten pelatih Timnas Indonesia Alex Pastoor #alexpastoor#pssi #sty#ericthohir
b0RNOylWXYQ,"Menurut coach justin ini alasan erick thohir tunjuk patrick kluivert ,alex pastoor ,denny landzaat!"
fjNQYqpXJss,🔴 BARU GABUNG LANGSUNG BERANI !! Alex Pastoor Langsung Ngomong Tegas Gini Soal Laga Timnas Indonesia
akf63vu27DE,"Alex Pastoor, juru taktik jenius dari Timnas! 🧠 #timnasindonesia #kluivert"
vZS8CpKPtwQ,Alex Pastoor buktikan totalitasnya untuk Indonesia!
MXPbbmYxvCs,ALEX PASTOOR MENJADI SALAH SATU ASISTEN PELATIH UNTUK MELATIH TIMNAS INDONESIA
LAQA77Wo8ng,PROFESOR TAKTIK ALEX PASTOOR SIAP BANTU PATRICK KLUIVERT❗ RUBAH TIMNAS INDONESIA LEBIH MENGERIKAN
iLO3QNwVbZg,"Siapa Alex Pastoor? Calon Asisten Pelatih Yang Akan Dampingi Patrick Kluivert, Di Timnas Indonesia"
7OfFuSg-bl4,LEGENDA AJAX KAGET Lihat Pembagian Peran Patrick Kluivert dan Alex Pastoor di Timnas Indonesia #bola
yaDyAlQ1oM8,"MENARIK! RESPON THOM HAYE SOAL KOMBINASI ALEX PASTOOR, LANDZAAT DAN KLUIVERT DI TIMNAS"
Cg3nMABKKvQ,"Alex pastoor, Professor analisis nya timnas 🇮🇩⚽"
WLBxSeqlmow,Profil Alex Pastoor & Denny Landzaat: Kunci Sukses Baru Timnas Indonesia? 🔥
EhTGIIgctcU,Alex Pastoor Lebih Diterima Fans Timnas Indonesia Dibandingkan Patrick Kluivert #timnas
vGMbe11SdJ4,"Alex Pastoor Pelajari Peta Indonesia, Langkah Awal Demi Sukses Tim Garuda #alexpastoor #beritatimnas"
UrUurarc0Mg,Dia Alex Pastoor The Professor Sudah Menganalisis Timnas Indonesia
ZIIoyacgUXA,Patrick Kluivert Bicara: Bertemu Pemain Liga 1 Sampai Peluang Timnas Indonesia ke Piala Dunia
6CJ8uAjsjNc,"Blak-blakan Denny Landzaat, Alasan & Proses Dirinya Jadi Asisten Kluivert di Timnas Indonesia"
ONIRHZ3rJ0U,Coach Justin Bedah Taktik & Ruang Ganti Patrick Kluivert Bersama Timnas Indonesia | Liputan 6 Sport
9sfEn3vMpZI,EFEK MANIS PATRICK KLUIVERT! Raja gol EPL tergoda bela Timnas~Prediksi Thom Haye tepat
04Qs-EDanXY,SHIN TAE-YONG FIRED?! Indonesia Hires Patrick Kluivert As Head Coach | FIFA World Cup 2026
3g7c1kepHfs,All #UCL Goals: PATRICK KLUIVERT
VfY1GSV0xt8,Patrick Kluivert's best goals for FC Barcelona
52kBfu9MJiE,"Patrick Kluivert Akan Benahi Ruang Ganti, Akui Kenal Mees, Verdonk & Jay serta Soroti Marselino"
7myAWiONmr8,Patrick Kluivert Ungkap Jairo Riedewald Setuju Gabung Timnas Indonesia untuk Laga di Bulan Maret
ZhMIaULhHYk,"Sederet Nama Pemain Naturalisasi Baru, Perkuat Timnas Indonesia di Era Patrick Kluivert"
tc1Uv7jffZU,PENUNJUKKAN PATRICK KLUIVERT SEBAGAI PELATIH TIMNAS! BENARKAH KULTUR & KONFLIK INTERNAL PENYEBABNYA?
z1lEDyTFhos,Patrick Kluivert Pulang Dulu ke Belanda - [Top News]
GXrxZxyepWY,Live Press Conference: Perkenalan Tim Pelatih Timnas Indonesia
V7YZZcnyp7w,"[FULL] Pernyataan Perdana Patrick Kluivert jadi Pelatih Timnas Indonesia, Bicara Taktik-Naturalisasi"
fsI5VS7HIUo,"Patrick Kluivert Ajak Indra Sjafri Berdiskusi, Bahas Asisten Pelatih Lokal? | News Flash"
-8Fzjlrv4yY,Duet MAUT! Pencapaian Manis Patrick Kluivert dan Louis Van Gaal
vYwNAAMIIqU,Pesan Pertama Pelatih Timnas Patrick Kluivert Untuk Suporter Indonesia | Liputan 6
xQVRJNWXxkQ,ERICK THOHIR & PATRICK KLUIVERT
fkdaUJlFxko,"[FULL] Tanya Jawab dengan Patrick Kluivert: Bicara Raih Hati Suporter, Target hingga Taktik Timnas"
lDqpJ9XYvAw,"Di Mata Najwa, Patrick Kluivert Tolak Bahas Keterlibatannya di Skandal Judi Bola | Narasi Daily"
HPLpiLB0qgo,Patrick Kluivert Terapkan Formasi 4-3-3 di Timnas Indonesia? Ini Analisis Coach Justin | Liputan 6
z8c8ZpPi0wI,[FULL] Prediksi Pemain 'Incaran' Patrick Kluivert di Timnas Indonesia: Dominan Lokal atau Keturunan?
O-wUF30uAb8,Widih Ngeri! Susunan Pemain Timnas Indonesia Era Patrick Kluivert
MAhviHwNQlQ,Kluivert Pimpin Latihan Perdana Timnas di Australia - [Primetime News]
cCh2H9o5Xpk,"Patrick Kluivert Bicara Target Bersama Timnas Indonesia, Suporter hingga Pemain Favorit"
n6WTn6zPAY0,"[HEADLINE NEWS, 12/01] Patrick Kluivert Siap Latih Timnas Indonesia"
1Eadb82N4b0,Respons Arya Sinulingga PSSI Soal Patrick Kluivert Bakal Bertemu Shin Tae-yong
ccIztsdJdNA,JADI MERINDING! Satu ruangan dibuat kaget dengan ambisi Patrick Kluivert~Agenda padat bakal dilahap
oS9_NuDpk-w,Patrick Kluivert 'janji' bawa Indonesia ke Piala Dunia
6TQuGykTiLA,[BREAKING NEWS] Siap Tempur! Kluivert akan Berjuang Bersama Skuad Garuda Lolos Piala Dunia | tvOne
WtUm7ZUJoNA,Fakta menarik Patrick Kluivert pelatih baru Timnas Indonesia‼️
NSMdD-__kzs,Viral! Video Momen Patrick Kluivert Makan Nasi Padang
D6OfzSZ2r1U,Erick Thohir Beberkan Isi Pertemuan Patrick Kluivert dengan 5 Pemain Timnas Indonesia
TJ6EKZV_SjQ,"[FULL] Pengenalan Pelatih Baru Timnas Indonesia, Patrick Kluivert"
fMuPu0XnDHk,OLE DAN JAIRO KEPINGAN TERAKHIR DARI STRATEGI MENYERANG PATRICK KLUIVERT!
lVNM0_Jk9WQ,Patrick Kluivert vs. other legendary forwards 👀
Lm2ammg4dng,Menanti Racikan Patrick Kluivert | AKIP tvOne
6HhlnrzMBe4,Patrick Kluivert Tinjau Latihan Timnas U-20 di Stadion Madya Senayan
ss-vVt8nmQo,Kompak! Pemain hingga Pelatih Timnas Bikin Video Selamat Datang untuk Patrick Kluivert | Liputan 6
IrdLyhtYO04,"[Full] Menuju Pildun 2026, Bisakah Kluivert Bawa Indonesia Lebih Jauh? - Rakyat Bersuara 14/01"
KMT0ACENnp0,BREAKING NEWS! DETIK - DETIK PATRICK KLUIVERT TIBA DI INDONESIA
B9nOMuVnHxs,Pelatih Timnas Patrick Kluivert Beber Target hingga Ungkap Pemain Lokal Indonesia Paling Favorit
YpZImVBf8-g,"Arya Beber Kegiatan Patrick Kluivert Jelang Diperkenalkan, Bertemu Pemain Timnas hingga Lihat GBK"
Dj4p1NxYF2s,Patrick Kluivert Selamatkan Kucing
zumMm7korPE,"Patrick Kluivert Menitipkan Salam Kepada Ketum PSSI, Erick Thohir"
kKfyGoKP_Yo,Patrick Kluivert Pelatih Timnas Indonesia Pakai Peci
dUz7u0P2jeE,Eksklusif Patrick Kluivert di Mata Najwa
gF0IgKiUlZA,BREAKING NEWS [FULL] - Ini Target Patrick Kluivert untuk Timnas Indonesia
U_v75E6vJTI,Alasan Shin Tae-yong Dipecat PSSI dari Timnas Indonesia
zFoOEblzYQo,Teruangkap! 3 Alasan PSSI Pilih Patrick Kluivert Jadi Pelatih Timnas Indonesia
pcvF5SBWjdI,Shin Tae-yong Didepak! PSSI Resmi Pecat Pelatih Timnas Indonesia #timnasindonesia #pssi #sty
msVQX7nGz1o,Ternyata ini alasan STY dipecat #shintaeyong #erickthohir #timnasindonesia #pssi #beritaviral
WCfn66rrRNA,Reaksi Pemain Timnas Indonesia Usai Shin Tae-yong Dipecat PSSI
fmMGm1T6Hy0,Perkenalan Patrick Kluivert & 2 Asisten Pelatih Timnas Indonesia - [Newsline]
DOyI-Zq2t3w,🔴 BREAKING NEWS | RESMI! PSSI Perkenalkan Patrick Kluivert Pelatih Baru Timnas Indonesia
oUJwAoCDceY,Prestasi Shin Tae Yong Di Timnas Indonesia #shorts #shintaeyong #timnasindonesia #pssi
xwohloNOcm8,PSSI dianggap kurang beradab dalam cara memecat Shin Tae Yong. #timnasindonesia
GQQ0WUkCgbU,Live Press Conference: Rencana Baru Perkembangan Timnas Indonesia Tahun 2025
ZmgOHhXVoZo,"Resmi Tunjuk Patrick Kluivert Jadi Pelatih Timnas Indonesia, PSSI: Rekam Jejak Bersih | STY OUT"
O2Qt9h9akpY,Meski sudah dipecat Shin Tae yong tetap lanjutkan akademinya #shintaeyong #timnasindonesia #pssi
6E7eC-Q659M,"PSSI RESMI PECAT STY, ET SIAP MUNDUR JIKA #timnasindonesia #pssi #timnas"
92SnsqO8Hzk,Erick Thohir Ungkap Sosok Pelatih Baru Timnas Indonesia Usai PSSI Pecat Shin Tae-yong | Liputan 6
kCzH8M05HLU,Coach Shin Tae-Yong Resmi berpisah dengan Timnas Indonesia #shintaeyong #timnasindonesia #pssi
2ix7_8oT21Y,Sty dipecat pssi menimbulkan tanda tanya #timnasindonesia #pssi #sty
2LwqpkhYWCg,"ALASAN UTAMA Shin Tae yong Dipecat PSSI dari Kursi Pelatih Timnas Indonesia, Gagal di Piala AFF?"
1jgr-tlld00,Jawab cepat bersama coach Rahmad Darmawan🙌🏻 #timnasindonesia #pssi #boazsollosa #kitagaruda
7aHI092W-lQ,OH INI PENYEBABNYA SHIN TAE YONG DIPECAT #shintaeyong #timnasindonesia #pssi #erickthohir #berita
XiGQs9P701s,"Patrick Kluivert Sah, jadi Pelatih Timnas Indonesia #football #timnasindonesia #pssi"
v2Xa7ymA-4Y,KEMARAHAN ANAK SHIN TAE YONG USAI AYAHNYA DIPECAT PSSI #shintaeyong #sty #timnasindonesia #pssi
KtOZYNKG2Tg,Pakta Baru Sin Tae Yong #sty #pssi #sepakbola #timnasday #infoterkini #timnasindonesia #fyp
arGlpwU395o,3 Alasan STY Dipecat #timnasindonesia #pssi #shortsvideo #shorts #youtubeshorts
nHbOdrgp68o,Nih pengalaman Patrick Kluivert sebagai pelatih. #timnasindonesia #pssi #patrickkluivert #sty #et
0R8LrzWbaKo,Shin Tae yong ajak Erick Thohir bertemu #shintaeyong #erickthohir #timnasindonesia #pssi
kMtgLc6Apnk,RESMI‼️STY dipecat PSSI sebagai pelatih timnas Indonesia #shintaeyong #timnasindonesia #pssi
fS1g3zD_hgg,Shin Tae-yong Dipecat dari Kursi Pelatih Timnas Indonesia ! #timnasindonesia #pssi #shintaeyong
lkvtI2RdZRI,Rumor panas pergantian pelatih timnas indonesia #timnasindonesia #pssi #shintaeyong #timnas #mssport
UkOsPjJ2WpM,Berapa Kompensasi Yang Diterima STY Setelah Dipecat??
q3IULB6RYF4,Inilah Alasan Kenapa STY Dipecat??
HooujCioRmU,PREDIKSI LINE UP TIMNAS INDONESIA JIKA DILATIH PATRICK KLUIVERT VS AUSTRALIA
77LRy8VTScw,"SHIN TAE-YONG : TIBA2 MUNCUL, KEMARIN KEMANA ? #shintaeyoung #patrickkluivert #timnasindonesia #pssi"
MsWwFPaW14k,TIDAK ADA YANG BISA DI BANGGAKAN DARI STY KATANYA!!! #timnasindonesia #pssi #shintaeyong #shorts
7V0mWdNlZ6U,Louis van Gaal Gantikan Shin Tae-yong? PSSI Buka Suara #timnasindonesia #pssi #beritabola
kArGUTx4XBI,timnas indonesia dapat julukan baru dari KNVB #sepakbola #timnasindonesia #pssi
UsTADDnNQeg,Kita harus tetap dukung semua demi timnas Indonesia #football #shorts #timnasindonesia #pssi
IxNlM5LYdY8,Permintaan PSSI untuk STY : Minimal bisa Bahasa Indonesia #timnasindonesia #pssi #shintaeyong
u9kGnBxTGpU,STY ungkap sulit bagi dirinya melawan negaranya sendiri #Timnas #Timnasday #timnasindonesia #PSSI
jGXl7Xxv904,"ERICK THOHIR : SAYA IZIN KE FIFA, SAYA PAMIT #ericktohir #shintaeyoung #timnasindonesia #pssi"
5BiymnOtqww,"Setuju dengan pendapat Diego Michiels, Vivamania?🤔 #timnasindonesia #pssi #aff2024 #vivagoal"
sg_cYixVOXg,STY RESMI DI PECAT PSSI🙏🥺 #shortvideo #football #youtube #timnasindonesia #pssi #sty
